{
  "$schema": "https://json-schema.org/draft/2020-12/schema",
  "$id": "https://github.com/jihunni/Agentic-Drug-Discovery-System/blob/main/rl_env/specs/frontier_tokenizer_placebo_summary.schema.json",
  "title": "ADDS-Frontier payload-free tokenizer placebo readiness summary",
  "type": "object",
  "additionalProperties": false,
  "required": ["schema_version", "set_id", "protocol_id", "board_id", "status", "compiled_on", "public_coupled_placebo_summary_integrity_sha256", "private_packet_set_commitment", "private_key_set_commitment", "design_rule", "tokenizer_package", "tokenizer_package_version", "tokenizer_profiles", "evaluation_only_tokenizer_profiles", "heldout_evaluation_status", "heldout_evaluation_used_for_selection", "heldout_evaluation_preregistered", "heldout_evaluation_external_validation", "profile_search_trials_per_placebo", "five_arm_packet_count", "canonical_arm_count", "candidate_reveal_arm_count", "placebo_variant_count", "placebo_reveal_arm_count", "candidate_exact_structural_delta_count", "placebo_exact_structural_delta_count", "candidate_placebo_structural_match_count", "whitespace_token_count_match_count", "placebo_vocabulary_family_pass_count", "tokenizer_comparison_count", "tokenizer_exact_token_count_match_count", "all_tokenizer_count_match_placebo_count", "token_byte_length_histogram_match_count", "token_rank_decile_histogram_match_count", "deterministic_profile_search_replay_count", "baseline_profile_l1_distance_total", "optimized_profile_l1_distance_total", "profile_l1_distance_reduction_total", "strict_profile_improvement_placebo_count", "profile_component_comparison_count", "profile_component_nonregression_count", "profile_component_strict_improvement_count", "profile_encoding_comparison_count", "profile_encoding_nonregression_count", "distribution_optimization_acceptance_count", "heldout_tokenizer_comparison_count", "heldout_exact_token_count_match_count_baseline", "heldout_exact_token_count_match_count_optimized", "heldout_token_byte_length_histogram_match_count_baseline", "heldout_token_byte_length_histogram_match_count_optimized", "heldout_token_rank_decile_histogram_match_count_baseline", "heldout_token_rank_decile_histogram_match_count_optimized", "heldout_profile_l1_distance_baseline_total", "heldout_profile_l1_distance_optimized_total", "heldout_profile_l1_distance_reduction_total", "heldout_profile_encoding_nonregression_count", "heldout_profile_encoding_strict_improvement_count", "heldout_profile_encoding_regression_count", "heldout_profile_component_comparison_count", "heldout_profile_component_nonregression_count", "heldout_profile_component_strict_improvement_count", "heldout_profile_component_regression_count", "heldout_all_profile_nonregression_placebo_count", "heldout_all_profile_strict_improvement_placebo_count", "heldout_profile_regression_placebo_count", "heldout_token_count_absolute_gap_baseline_total", "heldout_token_count_absolute_gap_optimized_total", "heldout_token_count_absolute_gap_reduction_total", "heldout_token_count_gap_nonregression_count", "heldout_token_count_gap_strict_improvement_count", "heldout_token_count_gap_regression_count", "heldout_tokenizer_results", "heldout_family_results", "heldout_tokenizer_aggregate_improvement_count", "heldout_family_aggregate_improvement_count", "heldout_aggregate_profile_improvement_observed", "heldout_robust_placebo_generalization_ready", "heldout_token_count_confound_control_ready", "heldout_tokenizer_family_independence_established", "arm_role_balance_max_imbalance", "arm_role_balance_passed", "five_arm_design_ready", "structural_confound_control_ready", "tokenizer_count_confound_control_ready", "deterministic_distribution_optimization_ready", "tokenizer_distribution_confound_control_ready", "lexical_confound_control_ready", "human_semantic_review_required", "reviewer_assignment_count", "reviewer_response_count", "candidate_coupling_label_count", "placebo_invariance_label_count", "contrast_label_count", "consensus_label_count", "placebo_scientific_invariance_established", "candidate_scientific_coupling_established", "contrast_identifiability_established", "canonical_transition_coupling_coverage_ready", "oracle_revision_applied", "challenge_assignment_authorized", "expert_solve_gate_changed", "admission_gate_changed", "board_admitted_count", "baseline_model_runs_started", "benchmark_evidence_claimed", "private_payload_published", "nonclaims", "integrity_sha256"],
  "properties": {
    "schema_version": {"const": "adds.frontier-tokenizer-placebo-summary.v1"},
    "set_id": {"const": "adds-frontier-tokenizer-placebo-v1"},
    "protocol_id": {"const": "adds-frontier-v1"},
    "board_id": {"const": "adds-frontier-private-pilot-v1"},
    "status": {"const": "five_arm_tokenizer_placebo_packets_compiled_review_not_started"},
    "compiled_on": {"type": "string", "format": "date"},
    "public_coupled_placebo_summary_integrity_sha256": {"$ref": "#/$defs/sha256"},
    "private_packet_set_commitment": {"$ref": "#/$defs/sha256"},
    "private_key_set_commitment": {"$ref": "#/$defs/sha256"},
    "design_rule": {"const": "blind_canonical_targeted_reveal_and_three_content_null_reveals_with_equal_structure_whitespace_and_cl100k_o200k_token_counts"},
    "tokenizer_package": {"const": "tiktoken"},
    "tokenizer_package_version": {"const": "0.14.0"},
    "tokenizer_profiles": {"const": [
      {"encoding_name": "cl100k_base", "source_asset_url": "https://openaipublic.blob.core.windows.net/encodings/cl100k_base.tiktoken", "source_asset_sha256": "223921b76ee99bde995b7ff738513eef100fb51d18c93597a113bcffe865b2a7", "n_vocab": 100277, "mergeable_rank_count": 100256, "special_token_count": 5, "vocabulary_sha256": "c45339dd52b71083191b9547250f3447e45ed4d67d0560a28fe541700001acba"},
      {"encoding_name": "o200k_base", "source_asset_url": "https://openaipublic.blob.core.windows.net/encodings/o200k_base.tiktoken", "source_asset_sha256": "446a9538cb6c348e3516120d7c08b09f57c36495e2acfffe59a5bf8b0cfb1a2d", "n_vocab": 200019, "mergeable_rank_count": 199998, "special_token_count": 2, "vocabulary_sha256": "9eff60a5f9a550b06572a296a42915e5c7b9c5393ad7e5584abb614d6d95d172"}
    ]},
    "evaluation_only_tokenizer_profiles": {"const": [
      {"encoding_name": "r50k_base", "source_asset_url": "https://openaipublic.blob.core.windows.net/encodings/r50k_base.tiktoken", "source_asset_sha256": "306cd27f03c1a714eca7108e03d66b7dc042abe8c258b44c199a7ed9838dd930", "n_vocab": 50257, "mergeable_rank_count": 50256, "special_token_count": 1, "vocabulary_sha256": "fc1756df0d0abea2568bfef979a26c563381b7144f6bac10aac4a20e8f29e674"},
      {"encoding_name": "p50k_base", "source_asset_url": "https://openaipublic.blob.core.windows.net/encodings/p50k_base.tiktoken", "source_asset_sha256": "94b5ca7dff4d00767bc256fdd1b27e5b17361d7b8a5f968547f9f23eb70d2069", "n_vocab": 50281, "mergeable_rank_count": 50280, "special_token_count": 1, "vocabulary_sha256": "514697bc24623b6a2fdbba7f0ca3e170cf2530092ad251a0050b1333097ac765"}
    ]},
    "heldout_evaluation_status": {"const": "post_selection_diagnostic"},
    "heldout_evaluation_used_for_selection": {"const": false},
    "heldout_evaluation_preregistered": {"const": false},
    "heldout_evaluation_external_validation": {"const": false},
    "profile_search_trials_per_placebo": {"const": 512},
    "five_arm_packet_count": {"const": 10},
    "canonical_arm_count": {"const": 10},
    "candidate_reveal_arm_count": {"const": 10},
    "placebo_variant_count": {"const": 3},
    "placebo_reveal_arm_count": {"const": 30},
    "candidate_exact_structural_delta_count": {"const": 10},
    "placebo_exact_structural_delta_count": {"const": 30},
    "candidate_placebo_structural_match_count": {"const": 30},
    "whitespace_token_count_match_count": {"const": 30},
    "placebo_vocabulary_family_pass_count": {"const": 30},
    "tokenizer_comparison_count": {"const": 60},
    "tokenizer_exact_token_count_match_count": {"const": 60},
    "all_tokenizer_count_match_placebo_count": {"const": 30},
    "token_byte_length_histogram_match_count": {"const": 0},
    "token_rank_decile_histogram_match_count": {"const": 0},
    "deterministic_profile_search_replay_count": {"const": 30},
    "baseline_profile_l1_distance_total": {"const": 1908},
    "optimized_profile_l1_distance_total": {"const": 1454},
    "profile_l1_distance_reduction_total": {"const": 454},
    "strict_profile_improvement_placebo_count": {"const": 30},
    "profile_component_comparison_count": {"const": 120},
    "profile_component_nonregression_count": {"const": 120},
    "profile_component_strict_improvement_count": {"const": 102},
    "profile_encoding_comparison_count": {"const": 60},
    "profile_encoding_nonregression_count": {"const": 60},
    "distribution_optimization_acceptance_count": {"const": 30},
    "heldout_tokenizer_comparison_count": {"const": 60},
    "heldout_exact_token_count_match_count_baseline": {"const": 2},
    "heldout_exact_token_count_match_count_optimized": {"const": 4},
    "heldout_token_byte_length_histogram_match_count_baseline": {"const": 0},
    "heldout_token_byte_length_histogram_match_count_optimized": {"const": 0},
    "heldout_token_rank_decile_histogram_match_count_baseline": {"const": 0},
    "heldout_token_rank_decile_histogram_match_count_optimized": {"const": 0},
    "heldout_profile_l1_distance_baseline_total": {"const": 2166},
    "heldout_profile_l1_distance_optimized_total": {"const": 1940},
    "heldout_profile_l1_distance_reduction_total": {"const": 226},
    "heldout_profile_encoding_nonregression_count": {"const": 52},
    "heldout_profile_encoding_strict_improvement_count": {"const": 44},
    "heldout_profile_encoding_regression_count": {"const": 8},
    "heldout_profile_component_comparison_count": {"const": 120},
    "heldout_profile_component_nonregression_count": {"const": 98},
    "heldout_profile_component_strict_improvement_count": {"const": 74},
    "heldout_profile_component_regression_count": {"const": 22},
    "heldout_all_profile_nonregression_placebo_count": {"const": 26},
    "heldout_all_profile_strict_improvement_placebo_count": {"const": 22},
    "heldout_profile_regression_placebo_count": {"const": 4},
    "heldout_token_count_absolute_gap_baseline_total": {"const": 344},
    "heldout_token_count_absolute_gap_optimized_total": {"const": 342},
    "heldout_token_count_absolute_gap_reduction_total": {"const": 2},
    "heldout_token_count_gap_nonregression_count": {"const": 48},
    "heldout_token_count_gap_strict_improvement_count": {"const": 16},
    "heldout_token_count_gap_regression_count": {"const": 12},
    "heldout_tokenizer_results": {"const": [
      {"encoding_name": "r50k_base", "comparison_count": 30, "baseline_profile_l1_distance_total": 1084, "optimized_profile_l1_distance_total": 970, "profile_l1_distance_reduction_total": 114},
      {"encoding_name": "p50k_base", "comparison_count": 30, "baseline_profile_l1_distance_total": 1082, "optimized_profile_l1_distance_total": 970, "profile_l1_distance_reduction_total": 112}
    ]},
    "heldout_family_results": {"const": [
      {"family_id": "placebo_transport", "comparison_count": 20, "baseline_profile_l1_distance_total": 838, "optimized_profile_l1_distance_total": 700, "profile_l1_distance_reduction_total": 138, "profile_nonregression_count": 20, "profile_strict_improvement_count": 16, "profile_regression_count": 0},
      {"family_id": "placebo_schema", "comparison_count": 20, "baseline_profile_l1_distance_total": 596, "optimized_profile_l1_distance_total": 592, "profile_l1_distance_reduction_total": 4, "profile_nonregression_count": 14, "profile_strict_improvement_count": 12, "profile_regression_count": 6},
      {"family_id": "placebo_audit", "comparison_count": 20, "baseline_profile_l1_distance_total": 732, "optimized_profile_l1_distance_total": 648, "profile_l1_distance_reduction_total": 84, "profile_nonregression_count": 18, "profile_strict_improvement_count": 16, "profile_regression_count": 2}
    ]},
    "heldout_tokenizer_aggregate_improvement_count": {"const": 2},
    "heldout_family_aggregate_improvement_count": {"const": 3},
    "heldout_aggregate_profile_improvement_observed": {"const": true},
    "heldout_robust_placebo_generalization_ready": {"const": false},
    "heldout_token_count_confound_control_ready": {"const": false},
    "heldout_tokenizer_family_independence_established": {"const": false},
    "arm_role_balance_max_imbalance": {"const": 0},
    "arm_role_balance_passed": {"const": true},
    "five_arm_design_ready": {"const": true},
    "structural_confound_control_ready": {"const": true},
    "tokenizer_count_confound_control_ready": {"const": true},
    "deterministic_distribution_optimization_ready": {"const": true},
    "tokenizer_distribution_confound_control_ready": {"const": false},
    "lexical_confound_control_ready": {"const": false},
    "human_semantic_review_required": {"const": true},
    "reviewer_assignment_count": {"const": 0},
    "reviewer_response_count": {"const": 0},
    "candidate_coupling_label_count": {"const": 0},
    "placebo_invariance_label_count": {"const": 0},
    "contrast_label_count": {"const": 0},
    "consensus_label_count": {"const": 0},
    "placebo_scientific_invariance_established": {"const": false},
    "candidate_scientific_coupling_established": {"const": false},
    "contrast_identifiability_established": {"const": false},
    "canonical_transition_coupling_coverage_ready": {"type": "boolean"},
    "oracle_revision_applied": {"const": false},
    "challenge_assignment_authorized": {"const": false},
    "expert_solve_gate_changed": {"const": false},
    "admission_gate_changed": {"const": false},
    "board_admitted_count": {"const": 0},
    "baseline_model_runs_started": {"const": false},
    "benchmark_evidence_claimed": {"const": false},
    "private_payload_published": {"const": false},
    "nonclaims": {"type": "array", "minItems": 14, "uniqueItems": true, "items": {"type": "string", "minLength": 1}},
    "integrity_sha256": {"$ref": "#/$defs/sha256"}
  },
  "$defs": {"sha256": {"type": "string", "pattern": "^[0-9a-f]{64}$"}}
}
