{
  "admission_gate_changed": false,
  "all_tokenizer_count_match_placebo_count": 30,
  "arm_role_balance_max_imbalance": 0,
  "arm_role_balance_passed": true,
  "baseline_model_runs_started": false,
  "baseline_profile_l1_distance_total": 1908,
  "benchmark_evidence_claimed": false,
  "board_admitted_count": 0,
  "board_id": "adds-frontier-private-pilot-v1",
  "candidate_coupling_label_count": 0,
  "candidate_exact_structural_delta_count": 10,
  "candidate_placebo_structural_match_count": 30,
  "candidate_reveal_arm_count": 10,
  "candidate_scientific_coupling_established": false,
  "canonical_arm_count": 10,
  "canonical_transition_coupling_coverage_ready": false,
  "challenge_assignment_authorized": false,
  "compiled_on": "2026-08-23",
  "consensus_label_count": 0,
  "contrast_identifiability_established": false,
  "contrast_label_count": 0,
  "design_rule": "blind_canonical_targeted_reveal_and_three_content_null_reveals_with_equal_structure_whitespace_and_cl100k_o200k_token_counts",
  "deterministic_distribution_optimization_ready": true,
  "deterministic_profile_search_replay_count": 30,
  "distribution_optimization_acceptance_count": 30,
  "evaluation_only_tokenizer_profiles": [
    {
      "encoding_name": "r50k_base",
      "mergeable_rank_count": 50256,
      "n_vocab": 50257,
      "source_asset_sha256": "306cd27f03c1a714eca7108e03d66b7dc042abe8c258b44c199a7ed9838dd930",
      "source_asset_url": "https://openaipublic.blob.core.windows.net/encodings/r50k_base.tiktoken",
      "special_token_count": 1,
      "vocabulary_sha256": "fc1756df0d0abea2568bfef979a26c563381b7144f6bac10aac4a20e8f29e674"
    },
    {
      "encoding_name": "p50k_base",
      "mergeable_rank_count": 50280,
      "n_vocab": 50281,
      "source_asset_sha256": "94b5ca7dff4d00767bc256fdd1b27e5b17361d7b8a5f968547f9f23eb70d2069",
      "source_asset_url": "https://openaipublic.blob.core.windows.net/encodings/p50k_base.tiktoken",
      "special_token_count": 1,
      "vocabulary_sha256": "514697bc24623b6a2fdbba7f0ca3e170cf2530092ad251a0050b1333097ac765"
    }
  ],
  "expert_solve_gate_changed": false,
  "five_arm_design_ready": true,
  "five_arm_packet_count": 10,
  "heldout_aggregate_profile_improvement_observed": true,
  "heldout_all_profile_nonregression_placebo_count": 26,
  "heldout_all_profile_strict_improvement_placebo_count": 22,
  "heldout_evaluation_external_validation": false,
  "heldout_evaluation_preregistered": false,
  "heldout_evaluation_status": "post_selection_diagnostic",
  "heldout_evaluation_used_for_selection": false,
  "heldout_exact_token_count_match_count_baseline": 2,
  "heldout_exact_token_count_match_count_optimized": 4,
  "heldout_family_aggregate_improvement_count": 3,
  "heldout_family_results": [
    {
      "baseline_profile_l1_distance_total": 838,
      "comparison_count": 20,
      "family_id": "placebo_transport",
      "optimized_profile_l1_distance_total": 700,
      "profile_l1_distance_reduction_total": 138,
      "profile_nonregression_count": 20,
      "profile_regression_count": 0,
      "profile_strict_improvement_count": 16
    },
    {
      "baseline_profile_l1_distance_total": 596,
      "comparison_count": 20,
      "family_id": "placebo_schema",
      "optimized_profile_l1_distance_total": 592,
      "profile_l1_distance_reduction_total": 4,
      "profile_nonregression_count": 14,
      "profile_regression_count": 6,
      "profile_strict_improvement_count": 12
    },
    {
      "baseline_profile_l1_distance_total": 732,
      "comparison_count": 20,
      "family_id": "placebo_audit",
      "optimized_profile_l1_distance_total": 648,
      "profile_l1_distance_reduction_total": 84,
      "profile_nonregression_count": 18,
      "profile_regression_count": 2,
      "profile_strict_improvement_count": 16
    }
  ],
  "heldout_profile_component_comparison_count": 120,
  "heldout_profile_component_nonregression_count": 98,
  "heldout_profile_component_regression_count": 22,
  "heldout_profile_component_strict_improvement_count": 74,
  "heldout_profile_encoding_nonregression_count": 52,
  "heldout_profile_encoding_regression_count": 8,
  "heldout_profile_encoding_strict_improvement_count": 44,
  "heldout_profile_l1_distance_baseline_total": 2166,
  "heldout_profile_l1_distance_optimized_total": 1940,
  "heldout_profile_l1_distance_reduction_total": 226,
  "heldout_profile_regression_placebo_count": 4,
  "heldout_robust_placebo_generalization_ready": false,
  "heldout_token_byte_length_histogram_match_count_baseline": 0,
  "heldout_token_byte_length_histogram_match_count_optimized": 0,
  "heldout_token_count_absolute_gap_baseline_total": 344,
  "heldout_token_count_absolute_gap_optimized_total": 342,
  "heldout_token_count_absolute_gap_reduction_total": 2,
  "heldout_token_count_confound_control_ready": false,
  "heldout_token_count_gap_nonregression_count": 48,
  "heldout_token_count_gap_regression_count": 12,
  "heldout_token_count_gap_strict_improvement_count": 16,
  "heldout_token_rank_decile_histogram_match_count_baseline": 0,
  "heldout_token_rank_decile_histogram_match_count_optimized": 0,
  "heldout_tokenizer_aggregate_improvement_count": 2,
  "heldout_tokenizer_comparison_count": 60,
  "heldout_tokenizer_family_independence_established": false,
  "heldout_tokenizer_results": [
    {
      "baseline_profile_l1_distance_total": 1084,
      "comparison_count": 30,
      "encoding_name": "r50k_base",
      "optimized_profile_l1_distance_total": 970,
      "profile_l1_distance_reduction_total": 114
    },
    {
      "baseline_profile_l1_distance_total": 1082,
      "comparison_count": 30,
      "encoding_name": "p50k_base",
      "optimized_profile_l1_distance_total": 970,
      "profile_l1_distance_reduction_total": 112
    }
  ],
  "human_semantic_review_required": true,
  "integrity_sha256": "50df2c64fc8047cf4f84133487530e56cb31dda9a62d64370e2fdde6ab32f895",
  "lexical_confound_control_ready": false,
  "nonclaims": [
    "Aggregate evaluation-only improvement coexists with four regressing placebos, so robust generalization remains false.",
    "Author-expected candidate changes and placebo intent are sealed selection metadata, not observations.",
    "Deterministic profile search does not establish syntax, readability, or lexical familiarity equivalence.",
    "Distribution optimization is in-sample over fixed lexical candidates, not external validation.",
    "Exact cl100k_base and o200k_base token counts do not match token identities or distributions.",
    "Lower proxy-histogram distance does not establish token-distribution equivalence.",
    "No arm role, task, oracle, evidence text, identity, nonce, or reviewer payload is public.",
    "No oracle revision, challenge assignment, board admission, model run, or benchmark result is authorized.",
    "No reviewer was assigned and no coupling, invariance, contrast, consensus, or adjudication label exists.",
    "Search and acceptance use only the two frozen design encodings; evaluation-only diagnostics do not make the optimizer tokenizer-general.",
    "Ten five-arm packets are machine-compiled experiment drafts, not independently reviewed labels.",
    "The r50k_base and p50k_base post-selection audit is not preregistered, held-out model evaluation, or external validation.",
    "The two evaluation encodings share a 50k tokenizer family and do not establish broad tokenizer independence.",
    "Three neutral-vocabulary families do not establish scientific irrelevance or placebo invariance."
  ],
  "optimized_profile_l1_distance_total": 1454,
  "oracle_revision_applied": false,
  "placebo_exact_structural_delta_count": 30,
  "placebo_invariance_label_count": 0,
  "placebo_reveal_arm_count": 30,
  "placebo_scientific_invariance_established": false,
  "placebo_variant_count": 3,
  "placebo_vocabulary_family_pass_count": 30,
  "private_key_set_commitment": "b33e032b37740f1356d1eac3fff3c05551bddd3a8ea4a41b53e452dca4100db9",
  "private_packet_set_commitment": "0dcdd66ca828fed97ce4e6a5b47343202df5ce888b7d2c0dafd430b8d1f8c657",
  "private_payload_published": false,
  "profile_component_comparison_count": 120,
  "profile_component_nonregression_count": 120,
  "profile_component_strict_improvement_count": 102,
  "profile_encoding_comparison_count": 60,
  "profile_encoding_nonregression_count": 60,
  "profile_l1_distance_reduction_total": 454,
  "profile_search_trials_per_placebo": 512,
  "protocol_id": "adds-frontier-v1",
  "public_coupled_placebo_summary_integrity_sha256": "d4fbad84fad4c4c01656dfb330f04da3ee3f8d303d5d04cd14927a2759b101ea",
  "reviewer_assignment_count": 0,
  "reviewer_response_count": 0,
  "schema_version": "adds.frontier-tokenizer-placebo-summary.v1",
  "set_id": "adds-frontier-tokenizer-placebo-v1",
  "status": "five_arm_tokenizer_placebo_packets_compiled_review_not_started",
  "strict_profile_improvement_placebo_count": 30,
  "structural_confound_control_ready": true,
  "token_byte_length_histogram_match_count": 0,
  "token_rank_decile_histogram_match_count": 0,
  "tokenizer_comparison_count": 60,
  "tokenizer_count_confound_control_ready": true,
  "tokenizer_distribution_confound_control_ready": false,
  "tokenizer_exact_token_count_match_count": 60,
  "tokenizer_package": "tiktoken",
  "tokenizer_package_version": "0.14.0",
  "tokenizer_profiles": [
    {
      "encoding_name": "cl100k_base",
      "mergeable_rank_count": 100256,
      "n_vocab": 100277,
      "source_asset_sha256": "223921b76ee99bde995b7ff738513eef100fb51d18c93597a113bcffe865b2a7",
      "source_asset_url": "https://openaipublic.blob.core.windows.net/encodings/cl100k_base.tiktoken",
      "special_token_count": 5,
      "vocabulary_sha256": "c45339dd52b71083191b9547250f3447e45ed4d67d0560a28fe541700001acba"
    },
    {
      "encoding_name": "o200k_base",
      "mergeable_rank_count": 199998,
      "n_vocab": 200019,
      "source_asset_sha256": "446a9538cb6c348e3516120d7c08b09f57c36495e2acfffe59a5bf8b0cfb1a2d",